{
  "generated_at_utc": "2026-10-29T18:28:50Z",
  "schema": "agilab.capabilities.v1",
  "schema_version": 1,
  "generated_by": {
    "tool": "tools/agilab_capabilities_manifest.py",
    "command": "python3 tools/agilab_capabilities_manifest.py --apply"
  },
  "source": {
    "repository": "https://github.com/ThalesGroup/agilab",
    "documentation": "https://thalesgroup.github.io/agilab/",
    "project": "agilab",
    "version": "2026.10.16"
  },
  "boundary": {
    "proves": "This manifest proves that public AGILAB surfaces are discoverable from checked-in contracts.",
    "does_not_prove": "It does not prove runtime success, external service reachability, security certification, or production readiness."
  },
  "summary": {
    "cli_command_count": 16,
    "streamlit_page_count": 6,
    "package_count": 39,
    "public_app_count": 14,
    "agent_skill_count": 33,
    "evidence_schema_count": 321,
    "catalog_file_count": 12
  },
  "cli_commands": [
    {
      "id": "agent-tasks",
      "command": "python -m agilab.agent_runtime.tasks --help",
      "kind": "agent-evidence",
      "maturity": "local-proof",
      "description": "Persist selected experiment tasks with exact-attempt approval, worker leases, cancellation, reconciliation and explicit retry; optional MCP adapter uses --task-root.",
      "docs": [
        "docs/source/agent-workflows.rst"
      ],
      "evidence_outputs": [
        "agilab.agent_task.v1",
        "agilab.agent_task_action.v1"
      ]
    },
    {
      "id": "agent-experiment",
      "command": "python -m agilab.agent_runtime.experiment prepare|run|verify ...",
      "kind": "agent-evidence",
      "maturity": "local-proof",
      "description": "Execute selected frozen Python inputs and independently grade outputs with verifiable attempt receipts.",
      "docs": [
        "docs/source/agent-workflows.rst"
      ],
      "evidence_outputs": [
        "agilab.agent_experiment_plan.v1",
        "agilab.agent_experiment_receipt.v1"
      ]
    },
    {
      "id": "agent-experiment-pilot",
      "command": "python -m agilab.agent_runtime.experiment_demo --output <new-directory>",
      "kind": "agent-evidence",
      "maturity": "local-proof",
      "description": "Compare a deterministic baseline and candidate on a frozen cohort, retaining failed acceptance and unknown model usage.",
      "docs": [
        "docs/source/agent-workflows.rst"
      ],
      "evidence_outputs": [
        "agilab.agent_experiment_comparison.v1"
      ]
    },
    {
      "id": "ui",
      "command": "agilab",
      "kind": "react-ui",
      "maturity": "live-product-path",
      "description": "Launch the local React workbench with Python views.",
      "docs": [
        "docs/source/quick-start.rst",
        "docs/source/agilab-help.rst"
      ],
      "evidence_outputs": []
    },
    {
      "id": "first-proof",
      "command": "agilab first-proof --json",
      "aliases": [
        "agilab dry-run"
      ],
      "kind": "proof",
      "maturity": "local-proof",
      "description": "Run the packaged first proof and emit install/run evidence.",
      "docs": [
        "docs/source/quick-start.rst",
        "docs/source/release-proof.rst"
      ],
      "evidence_outputs": [
        "run_manifest.json"
      ]
    },
    {
      "id": "workflow-validate",
      "command": "agilab workflow validate <lab_stages.toml> --dry-run --json",
      "kind": "workflow-contract",
      "maturity": "contract-proof",
      "description": "Validate stage, dependency, role, artifact-flow, and app-reference contracts without executing user code.",
      "docs": [
        "docs/source/capability-map.rst",
        "docs/source/features.rst"
      ],
      "evidence_outputs": [
        "agilab.workflow_dry_run_report.v1"
      ]
    },
    {
      "id": "agent-run",
      "command": "agilab agent-run ...",
      "kind": "agent-evidence",
      "maturity": "live-product-path",
      "description": "Wrap coding-agent actions with redacted manifests, traces, and local artifact pointers.",
      "docs": [
        "docs/source/agent-workflows.rst"
      ],
      "evidence_outputs": [
        "agilab.agent_run.v1",
        "agilab.agent_trace.v1"
      ]
    },
    {
      "id": "agent-context-router",
      "command": "python3 tools/agent_context_router.py [--profile agilab] --files <paths> --prompt <task> --json",
      "kind": "agent-context",
      "maturity": "contract-proof",
      "description": "Recommend AGILAB runbooks and repo-managed skills from changed files or task text, with an optional scoped context profile, without executing agent tools.",
      "docs": [
        "docs/source/agent-workflows.rst"
      ],
      "evidence_outputs": [
        "agilab.agent_context_recommendation.v1"
      ]
    },
    {
      "id": "agenticweb-manifest",
      "command": "python3 tools/agenticweb_manifest.py --check",
      "kind": "agent-discovery",
      "maturity": "contract-proof",
      "description": "Validate the generated root agenticweb.md discovery file against the AGILAB capability manifest.",
      "docs": [
        "docs/source/agent-workflows.rst",
        "docs/source/capability-map.rst"
      ],
      "evidence_outputs": [
        "agilab.agenticweb_discovery.v1"
      ]
    },
    {
      "id": "agent-instruction-contract",
      "command": "python3 tools/agent_instruction_contract.py --check",
      "kind": "agent-runbook-contract",
      "maturity": "contract-proof",
      "description": "Validate that root agent runbooks, public agent docs, and discovery manifests describe the same executable contract.",
      "docs": [
        "docs/source/agent-workflows.rst"
      ],
      "evidence_outputs": [
        "agilab.agent_instruction_contract.v1"
      ]
    },
    {
      "id": "agent-commit-provenance",
      "command": "python3 tools/agent_commit_provenance_guard.py --check-config",
      "kind": "agent-provenance",
      "maturity": "contract-proof",
      "description": "Reject human Git author or committer identities on agent-prefixed branches and inventory merged agent PR provenance.",
      "docs": [
        "docs/source/agent-workflows.rst"
      ],
      "evidence_outputs": [
        "agilab.agent_commit_provenance.v1"
      ]
    },
    {
      "id": "data-artifact-lane-contract",
      "command": "python3 tools/data_artifact_lane_contract.py --profile data-analysis --root <bundle> --check",
      "kind": "data-artifact-contract",
      "maturity": "contract-proof",
      "description": "Validate local data-analysis or document-ingestion handoff lanes for required directories, artifacts, and hashes.",
      "docs": [
        "docs/source/data-connectors.rst",
        "docs/source/capability-map.rst"
      ],
      "evidence_outputs": [
        "agilab.data_artifact_lane_contract.v1"
      ]
    },
    {
      "id": "regulatory-readiness-report",
      "command": "python3 tools/regulatory_readiness_report.py --profile eu-ai-act-screening --run-manifest <run_manifest.json> --check --json",
      "kind": "regulatory-readiness",
      "maturity": "contract-proof",
      "description": "Screen AGILAB run evidence for regulatory-review readiness gaps without claiming legal compliance.",
      "docs": [
        "docs/source/regulatory-readiness.rst",
        "docs/source/capability-map.rst",
        "docs/source/evidence-claims-policy.rst"
      ],
      "evidence_outputs": [
        "agilab.regulatory_readiness.v1"
      ]
    },
    {
      "id": "security-check",
      "command": "agilab security-check --json --strict",
      "kind": "security-posture",
      "maturity": "contract-proof",
      "description": "Inspect local AGILAB safety posture and fail on strict adoption blockers.",
      "docs": [
        "docs/source/security-adoption.rst"
      ],
      "evidence_outputs": [
        "security check JSON report"
      ]
    },
    {
      "id": "proof-capsule",
      "command": "agilab prove|verify|sign|replay|export-lineage|policy-check|cards|metadata-store ...",
      "kind": "evidence-core",
      "maturity": "live-product-path",
      "description": "Create, inspect, replay, and package run evidence and proof capsules.",
      "docs": [
        "docs/source/proof-capsule.rst",
        "docs/source/advanced-proof-pack.rst"
      ],
      "evidence_outputs": [
        "agilab.proof_capsule.v1",
        ".agipack",
        "lineage export",
        "policy report"
      ]
    },
    {
      "id": "app-surface",
      "command": "agilab app surface <project> --ui <backend>",
      "kind": "app-ui-surface",
      "maturity": "live-product-path",
      "description": "Launch an app-declared UI surface through the generic app surface route.",
      "docs": [
        "docs/source/public-app-catalog.rst",
        "docs/source/pytorch-playground.rst"
      ],
      "evidence_outputs": [
        "app surface metadata"
      ]
    }
  ],
  "streamlit_pages": [
    {
      "title": "ABOUT",
      "url_path": "",
      "source": "src/agilab/main_page.py",
      "visible_in_nav": false,
      "purpose": "product overview, first-proof wizard, and entry routing",
      "exists": true
    },
    {
      "title": "SETTINGS",
      "url_path": "SETTINGS",
      "source": "src/agilab/pages/0_SETTINGS.py",
      "visible_in_nav": false,
      "purpose": "runtime diagnostics and local environment settings",
      "exists": true
    },
    {
      "title": "PROJECT",
      "url_path": "PROJECT",
      "source": "src/agilab/pages/PROJECT_EDITOR.py",
      "visible_in_nav": false,
      "purpose": "project selection, creation, import, export, and package updates",
      "exists": true
    },
    {
      "title": "ORCHESTRATE",
      "url_path": "ORCHESTRATE",
      "source": "src/agilab/pages/2_ORCHESTRATE.py",
      "visible_in_nav": true,
      "purpose": "install, execute, cluster/service controls, and run evidence",
      "exists": true
    },
    {
      "title": "WORKFLOW",
      "url_path": "WORKFLOW",